{
  "packet_type": "council-review-packet",
  "recorded_at": "2026-06-15T05:39:18.015Z",
  "review_packet_id": "CREV-MQES9OCF-XNMPDQ",
  "council_id": "architecture-council",
  "stage": "review",
  "review_status": "approved",
  "decision_summary": "The runtime proof slice is coherent and auditable.",
  "rationale": "Allocation, execution, and policy evidence align under the backend-neutral contract layer.",
  "recommendation": "Record the outcome and project the next runtime proof step.",
  "target_audience": null,
  "expected_user_reaction": null,
  "blocking_reasons": [],
  "artifact_change_recommendations": [],
  "organization_change_recommendations": [],
  "human_override_signal": null,
  "team_output_refs": [
    ".aof/artifacts/execution/team-outputs/TOUT-MQES9OCE-9E8HSB.json"
  ],
  "role_result_refs": [
    ".aof/artifacts/execution/role-results/RRES-MQES9OCD-ZKL3LM.json",
    ".aof/artifacts/execution/role-results/RRES-MQES9OCE-FCVGU7.json"
  ],
  "evidence_refs": [
    ".aof/artifacts/allocation/plans/APL-MQES9OC9-2AWDX3.json",
    ".aof/artifacts/allocation/policy-evaluations/PER-MQES9OCB-46S1T6.json",
    ".aof/artifacts/allocation/resource-claims/RCL-MQES9OCC-L9W3KW.json"
  ],
  "follow_up_task_ids": [
    "TASK-011"
  ],
  "escalation_required": false,
  "source_task_id": "TASK-011",
  "source_parent_session_id": "SESS-MQES9OAT-65F1R1",
  "source_decision_record_id": "DEC-MQES9OBE-AXCD2E"
}
