{
  "packet_type": "council-review-packet",
  "recorded_at": "2026-06-15T02:34:17.282Z",
  "review_packet_id": "CREV-MQELNQYQ-L57FOA",
  "council_id": "architecture-council",
  "stage": "review",
  "review_status": "approved",
  "decision_summary": "The runtime proof slice is coherent and auditable.",
  "rationale": "Allocation, execution, and policy evidence align under the backend-neutral contract layer.",
  "recommendation": "Record the outcome and project the next runtime proof step.",
  "team_output_refs": [
    ".aof/artifacts/execution/team-outputs/TOUT-MQELNQ4O-WJ0BTG.json"
  ],
  "role_result_refs": [
    ".aof/artifacts/execution/role-results/RRES-MQELNOKB-P624DX.json",
    ".aof/artifacts/execution/role-results/RRES-MQELNPNG-JLTTLD.json"
  ],
  "evidence_refs": [
    ".aof/artifacts/allocation/plans/APL-MQELNLXX-WUJKMG.json",
    ".aof/artifacts/allocation/policy-evaluations/PER-MQELNMX6-RZHKOW.json",
    ".aof/artifacts/allocation/resource-claims/RCL-MQELNNLT-IGH1UA.json"
  ],
  "follow_up_task_ids": [
    "TASK-011"
  ],
  "escalation_required": false,
  "source_task_id": "TASK-011",
  "source_parent_session_id": "SESS-MQELNLET-7T4O6L",
  "source_decision_record_id": "DEC-MQELNLXL-H4MHES"
}
