{
  "packet_type": "council-review-packet",
  "recorded_at": "2026-06-14T04:55:33.728Z",
  "review_packet_id": "CREV-MQDB9KRK-SU18IS",
  "council_id": "architecture-council",
  "stage": "review",
  "review_status": "approved",
  "decision_summary": "The runtime proof slice is coherent and auditable.",
  "rationale": "Allocation, execution, and policy evidence align under the backend-neutral contract layer.",
  "recommendation": "Record the outcome and project the next runtime proof step.",
  "team_output_refs": [
    ".aof/artifacts/execution/team-outputs/TOUT-MQDB9KRJ-DKMB3W.json"
  ],
  "role_result_refs": [
    ".aof/artifacts/execution/role-results/RRES-MQDB9KRI-TIPGAZ.json",
    ".aof/artifacts/execution/role-results/RRES-MQDB9KRJ-9TSDUP.json"
  ],
  "evidence_refs": [
    ".aof/artifacts/allocation/plans/APL-MQDB9KRG-H8DVL3.json",
    ".aof/artifacts/allocation/policy-evaluations/PER-MQDB9KRH-IRAN3C.json",
    ".aof/artifacts/allocation/resource-claims/RCL-MQDB9KRH-29JWYT.json"
  ],
  "follow_up_task_ids": [
    "TASK-011"
  ],
  "escalation_required": false,
  "source_task_id": "TASK-011",
  "source_parent_session_id": "SESS-MQDB9KQX-YGZC5Z",
  "source_decision_record_id": "DEC-MQDB9KR4-B9D9QA"
}
