{
  "packet_type": "council-review-packet",
  "recorded_at": "2026-06-15T15:01:00.000Z",
  "review_packet_id": "CREV-BENCH-DG003-RUNTIME-LOOP-CLASSIFICATION",
  "council_id": "product-council",
  "stage": "review",
  "review_status": "approved",
  "decision_summary": "The runtime-generated multi-loop trace proves that the dominant diagnosis is a loop-gap pattern, not a missing-role pattern.",
  "rationale": "The runtime-generated RV-004 trace shows that the same role set remains in place while the benchmark becomes materially stronger only after additional review-loop refinement. Loop 2 improves machine-readable audit structure, and loop 3 broadens broken-chain failure-family coverage without adding a new role. The attached follow-up tasks also target review-validity operationalization and packet structure rather than staffing changes. That combination is the expected evidence for a loop-gap diagnosis rather than a role-gap diagnosis.",
  "recommendation": "Accept this runtime-generated loop-classification trace as DG-003 evidence and next add a complementary runtime-generated role-gap family.",
  "target_audience": "A framework operator deciding whether repeated misses should be fixed by adding people/roles or by strengthening the review loop itself.",
  "expected_user_reaction": "The operator should conclude that the improvement came from stronger loop discipline and evidence structure, not from missing-role replacement.",
  "blocking_reasons": [],
  "artifact_change_recommendations": [
    "Keep multi-loop traces explicit about which loop introduced the substantive correction.",
    "Preserve review packet fields that let operators see whether the corrective action is role-oriented or loop-oriented."
  ],
  "organization_change_recommendations": [
    "Treat benchmark loop expansion as the primary correction when the same role set improves through repeated review refinement.",
    "Add a separate runtime-generated diagnosis case where a true role gap is the dominant cause."
  ],
  "diagnosis_category": "runtime-loop-gap-proven",
  "diagnosis_confidence": 0.91,
  "diagnosis_evidence_refs": [
    ".aof/artifacts/benchmarks/fixtures/RV-004-runtime-loop-trace-context.json",
    ".aof/artifacts/execution/council-reviews/CREV-BENCH-RV004-RUNTIME-LOOP-TRACE.json",
    ".aof/tasks/open/TASK-029.json",
    ".aof/tasks/done/TASK-031.json",
    ".aof/artifacts/benchmarks/fixtures/DG-003-runtime-loop-classification-context.json"
  ],
  "human_override_signal": "Owner expectation: runtime-generated benchmark improvements should show what loop correction actually changed coverage rather than only adding more artifact volume.",
  "team_output_refs": [],
  "role_result_refs": [],
  "evidence_refs": [
    ".aof/artifacts/benchmarks/runtime-discipline-runs/RDB-20260615T125810Z.json",
    ".aof/artifacts/benchmarks/runtime-discipline-runs/RDB-20260615T141637Z.json",
    ".aof/artifacts/benchmarks/runtime-discipline-runs/RDB-20260615T142956Z.json",
    ".aof/tasks/open/TASK-029.json",
    ".aof/tasks/done/TASK-031.json"
  ],
  "follow_up_task_ids": [
    "TASK-029",
    "TASK-031"
  ],
  "escalation_required": false,
  "source_task_id": "TASK-029",
  "source_parent_session_id": "SESS-BENCH-RV004-RUNTIME-001",
  "source_decision_record_id": null
}
